{
  "$schema": "http://json-schema.org/draft-07/schema#",
  "$id": "https://techlab/arch/decisions/permission-catalogue.schema.json",
  "title": "Permission catalogue",
  "description": "Canonical catalogue of every permission code used in the system. Source of truth for: (a) RBAC bundle expansion (rbac.arch.json roles[*].permission_bundle of kind=all/exclude_patterns/match_pattern); (b) hard validation of @PreAuthorize codes emitted by the module generator; (c) the rendered permissoes.md catalogue document. D-060.",
  "type": "object",
  "required": [
    "_schema_version",
    "version",
    "modules"
  ],
  "additionalProperties": false,
  "properties": {
    "$comment": {
      "type": "string",
      "description": "Free-text note for maintainers; not consumed by any generator."
    },
    "_schema_version": {
      "type": "integer",
      "const": 1
    },
    "version": {
      "type": "string",
      "pattern": "^[0-9]+\\.[0-9]+\\.[0-9]+$"
    },
    "last_changed": {
      "type": "string",
      "pattern": "^[0-9]{4}-[0-9]{2}-[0-9]{2}$"
    },
    "convention": {
      "type": "object",
      "additionalProperties": false,
      "properties": {
        "format": {
          "type": "string"
        },
        "note": {
          "type": "string"
        }
      }
    },
    "modules": {
      "type": "array",
      "minItems": 0,
      "items": {
        "type": "object",
        "required": [
          "prefix",
          "name",
          "permissions"
        ],
        "additionalProperties": false,
        "properties": {
          "prefix": {
            "type": "string",
            "pattern": "^[a-z][a-z0-9_-]*$",
            "description": "Permission namespace prefix (e.g. 'com', 'est'). Matches the leading token of each permission code in this module."
          },
          "name": {
            "type": "string",
            "description": "Human-readable module name (e.g. 'Comercial')."
          },
          "package": {
            "type": "string",
            "description": "Java package suffix (e.g. 'comercial'). Optional — used by the rendered catalogue document."
          },
          "description": {
            "type": "string"
          },
          "permissions": {
            "type": "array",
            "minItems": 1,
            "items": {
              "type": "string",
              "description": "Full permission code (e.g. 'com.orcamento.criar'). May contain `{{ var }}` placeholders that get interpolated against project vars at render time. Each entry MUST start with '<prefix>.' (validated structurally)."
            }
          }
        }
      },
      "description": "Ships EMPTY in the source of truth (D-103 Gap B); projects fill it via arch/overrides/<aspect>.partial.json (D-074 deep-merge)."
    }
  }
}
